{
  "boot": {
    "argv": [
      "{python}",
      "-m",
      "uvicorn",
      "app:app",
      "--host",
      "127.0.0.1",
      "--port",
      "{port}",
      "--log-level",
      "warning"
    ],
    "cwd": "clone",
    "env": {}
  },
  "deferred": {
    "portal-member-source-fidelity": "The local member workflows are implemented and tested, but authenticated source-page fidelity remains unavailable until a read-only source login is present. Anonymous live diagnostics cannot create the required local member fixture."
  },
  "prepare": [],
  "routes": {
    "home": "/"
  },
  "schema_version": "offline-clone.verify-driver.v1",
  "site_id": "aspca-pet-insurance",
  "status": {
    "not-found": 404
  },
  "states": {
    "home.loaded": []
  }
}
